{
  "$schema": "../../schema/scenario-v1.schema.json",
  "schemaVersion": 1,
  "name": "MQ101 Fragment 287 disables controls and evaluates the player package",
  "adapter": "pex.mq101-fragment",
  "seed": 304,
  "participants": [
    { "id": "host", "role": "leader" },
    { "id": "guest", "role": "follower" }
  ],
  "actions": [
    { "at": 0, "actor": "host", "type": "papyrus.execute", "data": { "script": "QF_MQ101_0003372B", "function": "Fragment_287" } }
  ],
  "assertions": [
    { "after": 0, "type": "controls.enabledEquals", "data": { "enabled": false } },
    { "after": 0, "type": "trace.contains", "data": { "event": "actor.evaluatePackage:PlayerRef" } }
  ]
}
