{
  "$schema": "../../schema/scenario-v1.schema.json",
  "schemaVersion": 1,
  "name": "MQ101 Fragment 56 advances and moves the Helgen cast",
  "adapter": "pex.mq101-fragment",
  "seed": 303,
  "participants": [
    { "id": "host", "role": "leader" },
    { "id": "guest", "role": "follower" }
  ],
  "actions": [
    { "at": 0, "actor": "host", "type": "papyrus.execute", "data": { "script": "QF_MQ101_0003372B", "function": "Fragment_56" } }
  ],
  "assertions": [
    { "after": 0, "type": "quest.stagesEqual", "data": { "stages": [0, 80, 100, 120] } },
    { "after": 0, "type": "trace.contains", "data": { "event": "reference.moveTo:PlayerRef:PlayerMarker4" } },
    { "after": 0, "type": "trace.contains", "data": { "event": "alias.moveTo:Alias_Ulfric:UlfricKeepMarker1" } }
  ]
}
